section	paragraph	sentence	text	pmcid	matched_sequence
Results; A Novel AMP, LEAP-2, Was Isolated From the Head Kidney of Topmouth Culter	1	7	The N-terminal amino acid sequence of the purified peptide was determined as MTPLWRIMLLFKPHALCQNNY by Edman degradation.	PMC7719739	MTPLWRIMLLFKPHALCQNNY
Results; The Purified AMP From Topmouth Culter Belongs to LEAP-2 Family	1	5	The deduced mature peptide of topmouth culter LEAP-2 is composed of 41 amino acids (Figure 2, Table 1), and the N-terminal amino acid sequence of the deduced mature LEAP-2 is consistent with that (MTPLWRIMLLFKPHALCQNNY) obtained by Edman degradation.	PMC7719739	MTPLWRIMLLFKPHALCQNNY
1. Introduction	3	3	The best obtained analogue, a decapeptide named RiLK1 (RLKWVRIWRR-NH2), has been synthesized and characterized [41].	PMC8472000	RLKWVRIWRR
2. Results; 2.1. Molecular Design of RiLK1 Peptide	4	1	Based on all these evidences, the peptide RiLK1 (RLKWVRIWRR-NH_2) was de novo designed starting from the 1018-K6 sequence (VRLIVKVRIWRR-NH_2) [33].	PMC8472000	RLKWVRIWRR
2. Results; 2.1. Molecular Design of RiLK1 Peptide	4	1	Based on all these evidences, the peptide RiLK1 (RLKWVRIWRR-NH_2) was de novo designed starting from the 1018-K6 sequence (VRLIVKVRIWRR-NH_2) [33].	PMC8472000	VRLIVKVRIWRR
5. Patents	1	3	BALESTRIERI MARCO, PALMIERI GIANNA, NICOLAIS LUIGI.	PMC8472000	ALESTRIERI
1. Introduction	2	1	In this work, we explored the activity and selectivity of the α-helical peptide EcDBS1R4 (PMKKKLAARILAKIVAPVW), recently designed using the linguistic model-based algorithm Joker [22].	PMC7730630	PMKKKLAARILAKIVAPVW
3. Materials and Methods; 3.1. Materials	1	1	EcDBS1R4 (PMKKKLAARILAKIVAPVW, 95% of purity) was purchased from Peptide 2.0 (Chantilly, VA, USA).	PMC7730630	PMKKKLAARILAKIVAPVW
4. Materials and Methods; 4.1. Materials	1	1	The peptide Lasioglossin III (sequence: VNWKKILGKIIKVVK-NH_2) was chemically synthesized and purchased from Primm srl, Milano, Italy.	PMC8001998	VNWKKILGKIIKVVK
[Main]	4	1	In this study, we assessed the anti-coronavirus activity of the antibacterial peptide DP7 (VQWRIRVAVIRK), which was screened and verified by computer simulation in early studies in our laboratory.	PMC8012516	VQWRIRVAVIRK
MATERIALS AND METHODS; Solid-phase peptide synthesis	1	1	The following amide peptides, CZS-1: GFLDIVKGVGKVALGAVSKLF-NH_2, CZS4: GFLDVIKHVGKAALSVVSHLINE-NH_2, CZS-16: GFLDVLKGVGKAALGAVTHLINQ-NH_2, DRS-SP2: ASWKVFLKNIGKAAGKAVLNSVTDMVNQ-NH_2, and PTS-1: GFLDTLKNIGKTVGRIALNVLT-NH_2, were synthetized by solid-phase strategy (solid-phase peptide synthesis) applying 9-fluorenylmethoxycarbonyl chemistry in a 0.1-mM scale as described previously (28).	PMC11302733	GFLDIVKGVGKVALGAVSKLF
MATERIALS AND METHODS; Solid-phase peptide synthesis	1	1	The following amide peptides, CZS-1: GFLDIVKGVGKVALGAVSKLF-NH_2, CZS4: GFLDVIKHVGKAALSVVSHLINE-NH_2, CZS-16: GFLDVLKGVGKAALGAVTHLINQ-NH_2, DRS-SP2: ASWKVFLKNIGKAAGKAVLNSVTDMVNQ-NH_2, and PTS-1: GFLDTLKNIGKTVGRIALNVLT-NH_2, were synthetized by solid-phase strategy (solid-phase peptide synthesis) applying 9-fluorenylmethoxycarbonyl chemistry in a 0.1-mM scale as described previously (28).	PMC11302733	GFLDVIKHVGKAALSVVSHLINE
MATERIALS AND METHODS; Solid-phase peptide synthesis	1	1	The following amide peptides, CZS-1: GFLDIVKGVGKVALGAVSKLF-NH_2, CZS4: GFLDVIKHVGKAALSVVSHLINE-NH_2, CZS-16: GFLDVLKGVGKAALGAVTHLINQ-NH_2, DRS-SP2: ASWKVFLKNIGKAAGKAVLNSVTDMVNQ-NH_2, and PTS-1: GFLDTLKNIGKTVGRIALNVLT-NH_2, were synthetized by solid-phase strategy (solid-phase peptide synthesis) applying 9-fluorenylmethoxycarbonyl chemistry in a 0.1-mM scale as described previously (28).	PMC11302733	GFLDVLKGVGKAALGAVTHLINQ
MATERIALS AND METHODS; Solid-phase peptide synthesis	1	1	The following amide peptides, CZS-1: GFLDIVKGVGKVALGAVSKLF-NH_2, CZS4: GFLDVIKHVGKAALSVVSHLINE-NH_2, CZS-16: GFLDVLKGVGKAALGAVTHLINQ-NH_2, DRS-SP2: ASWKVFLKNIGKAAGKAVLNSVTDMVNQ-NH_2, and PTS-1: GFLDTLKNIGKTVGRIALNVLT-NH_2, were synthetized by solid-phase strategy (solid-phase peptide synthesis) applying 9-fluorenylmethoxycarbonyl chemistry in a 0.1-mM scale as described previously (28).	PMC11302733	ASWKVFLKNIGKAAGKAVLNSVTDMVNQ
MATERIALS AND METHODS; Solid-phase peptide synthesis	1	1	The following amide peptides, CZS-1: GFLDIVKGVGKVALGAVSKLF-NH_2, CZS4: GFLDVIKHVGKAALSVVSHLINE-NH_2, CZS-16: GFLDVLKGVGKAALGAVTHLINQ-NH_2, DRS-SP2: ASWKVFLKNIGKAAGKAVLNSVTDMVNQ-NH_2, and PTS-1: GFLDTLKNIGKTVGRIALNVLT-NH_2, were synthetized by solid-phase strategy (solid-phase peptide synthesis) applying 9-fluorenylmethoxycarbonyl chemistry in a 0.1-mM scale as described previously (28).	PMC11302733	GFLDTLKNIGKTVGRIALNVLT
1. Introduction	3	1	Antimicrobial peptide TS (GSKKPVPIIYCNRRSGKCQRM) is synthesized by substituting an amino acid for thanatin (GSKKPVPIIYCNRRTGKCQRM), which is isolated from the hemipteran insect Podisus maculiventris [17].	PMC7795306	GSKKPVPIIYCNRRSGKCQRM
1. Introduction	3	1	Antimicrobial peptide TS (GSKKPVPIIYCNRRSGKCQRM) is synthesized by substituting an amino acid for thanatin (GSKKPVPIIYCNRRTGKCQRM), which is isolated from the hemipteran insect Podisus maculiventris [17].	PMC7795306	GSKKPVPIIYCNRRTGKCQRM
3. Materials and Methods; 3.1. Synthesis and Purification of Antimicrobial Peptide TS	1	1	Antimicrobial peptide TS (GSKKPVPIIYCNRRSGKCQRM) was synthesized using standard Fmoc solid-phase peptide synthesis protocols (Science Peptide Co.	PMC7795306	GSKKPVPIIYCNRRSGKCQRM
2. Thanatin	1	3	The peptide is 21 amino acids long, with the primary structure GSKKPVPIIYCNRRTGKCQRM.	PMC7913509	GSKKPVPIIYCNRRTGKCQRM
3. In Vivo Antibacterial Activity of Thanatin	1	6	The bactericidal effects of native and L-thanatin (GSKKPVPIIYCNRRTGKCQRM with free thiols) were analyzed in extended-spectrum β-lactamase-producing E. coli (ESBL-EC)-infected mice.	PMC7913509	GSKKPVPIIYCNRRTGKCQRM
3. In Vivo Antibacterial Activity of Thanatin	1	8	C-terminal-amidated thanatin (A-Thanatin, GSKKPVPIIYCNRRTGKCQRM-amidated) is known to have greater tolerance to proteinase when compared to the native thanatin [24].	PMC7913509	GSKKPVPIIYCNRRTGKCQRM
3. In Vivo Antibacterial Activity of Thanatin	1	12	S-thanatin (GSKKPVPIIYCNRRSGKCQRM) presents a serine at position 15 instead of the threonine found in the native peptide [31].	PMC7913509	GSKKPVPIIYCNRRSGKCQRM
3. In Vivo Antibacterial Activity of Thanatin	1	18	A shorter derivative of thanatin or R-thanatin (IYNCRRRFCKQRCONH_2) was designed and examined against methicillin-resistant Staphylococcus epidermidis (MRSE) in a urinary tract infection rat model.	PMC7913509	IYNCRRRFCKQRC
MATERIALS AND METHODS; Peptide synthesis	1	2	The Smp24 peptide (IWSFLIKAATKLLPSLFGGGKKDS) and the Smp43 peptide (GVWDWIKKTAGKIWNSEPVKALKSQALNAAKNFVAEKIGATPS) were used.	PMC8125054	IWSFLIKAATKLLPSLFGGGKKDS
MATERIALS AND METHODS; Peptide synthesis	1	2	The Smp24 peptide (IWSFLIKAATKLLPSLFGGGKKDS) and the Smp43 peptide (GVWDWIKKTAGKIWNSEPVKALKSQALNAAKNFVAEKIGATPS) were used.	PMC8125054	GVWDWIKKTAGKIWNSEPVKALKSQALNAAKNFVAEKIGATPS
Results; Peptides Validated Through Previous Studies	1	3	Interestingly, this showed that many of the peptides originated from the hemoglobin subunit beta C-terminal (region 112-147 VCVLAHHFGKEFTPPVQAAYQKVVAGVANALAHKYH) which has been documented as AMPs (14-18).	PMC7888259	VCVLAHHFGKEFTPPVQAAYQKVVAGVANALAHKYH
Discussion; Antimicrobial Peptides in Wound Fluids	2	4	Indeed, Mak et al. showed that peptides such as AHHFGKEFTPPVQAAYQKVVAGVANALAHKYH derived from this hemoglobin region act as AMPs in the female genital tract (14, 15).	PMC7888259	AHHFGKEFTPPVQAAYQKVVAGVANALAHKYH
Discussion; Antimicrobial Peptides in Wound Fluids	2	5	Furthermore, Table 1 shows that several other peptides such as MVHLTPEEKSAVTALWGKVNV (36), AHLPAEFTPAVHA (19) and SFPTTKTYFPHFDLSHGSAQVK (14) also have proven antimicrobial properties.	PMC7888259	MVHLTPEEKSAVTALWGKVNV
Discussion; Antimicrobial Peptides in Wound Fluids	2	5	Furthermore, Table 1 shows that several other peptides such as MVHLTPEEKSAVTALWGKVNV (36), AHLPAEFTPAVHA (19) and SFPTTKTYFPHFDLSHGSAQVK (14) also have proven antimicrobial properties.	PMC7888259	AHLPAEFTPAVHA
Discussion; Antimicrobial Peptides in Wound Fluids	2	5	Furthermore, Table 1 shows that several other peptides such as MVHLTPEEKSAVTALWGKVNV (36), AHLPAEFTPAVHA (19) and SFPTTKTYFPHFDLSHGSAQVK (14) also have proven antimicrobial properties.	PMC7888259	SFPTTKTYFPHFDLSHGSAQVK
1. Introduction	4	1	Recently, solution structures of S1 (Ac-KKWRKWLAKK-NH_2) and S1-Nal-Nal (Ac-KKWRKWLAKKNal-Nal-NH_2) in complex with LPS micelles have been reported [37].	PMC7554977	KKWRKWLAKK
1. Introduction	4	1	Recently, solution structures of S1 (Ac-KKWRKWLAKK-NH_2) and S1-Nal-Nal (Ac-KKWRKWLAKKNal-Nal-NH_2) in complex with LPS micelles have been reported [37].	PMC7554977	KKWRKWLAKKN
1. Introduction	4	5	Moreover, a strategy was developed to increase salt resistance and LPS neutralization activities of P-113 (AKRHHGYKRKFH-NH_2) by replacing histidines with phenylalanine- (Phe-P-113), β-naphthylalanine- (Nal-P-113), β-diphenylalanine- (Dip-P-113), and β-(4,4′-biphenyl)alanine- (Bip-P-113).	PMC7554977	AKRHHGYKRKFH
2. Results; 2.1. Antimicrobial Peptides	1	2	KR-12 (KRIVQRIKDFLR) was derived from human host defense cathelicidin LL-37 and was found to possess antimicrobial activities against Gram-negative and Gram-positive bacteria.	PMC7554977	KRIVQRIKDFLR
3. Discussion	2	7	Chen-2 reproduces an original fragment (AHSIIYGVRGRGRI) from Chenopodin, suggesting their determinant role in the antibacterial activity of this protein.	PMC10812719	AHSIIYGVRGRGRI
4. Materials and Methods; 4.1. Computer-Aided Design of Cationic Peptides Based on Chenopodin; Screening of Chenopodin Sequence: Prediction of Toxicity, Structure and Biological Activity	1	4	Briefly, two peptides, Chen1 (YGVRGRGRIQIVNA) and Chen2 (AHSIIYGVRGRGRI), mimic short molecular fragments of the parent protein (Chenopodin).	PMC10812719	YGVRGRGRIQIVNA
4. Materials and Methods; 4.1. Computer-Aided Design of Cationic Peptides Based on Chenopodin; Screening of Chenopodin Sequence: Prediction of Toxicity, Structure and Biological Activity	1	4	Briefly, two peptides, Chen1 (YGVRGRGRIQIVNA) and Chen2 (AHSIIYGVRGRGRI), mimic short molecular fragments of the parent protein (Chenopodin).	PMC10812719	AHSIIYGVRGRGRI
Bacterial strains and plasmids	1	1	The gene encoding the antibacterial peptide abaecin, with the previously reported sequence FVPYNPPRPGQSKPFPSFPGHGPFNPK IQWPYPLPNPGH,^18 was synthesized using a TEV protease cleavage locus gene, a beta-glucanase mature peptide, and signal peptide gene (gmp and gsp) as a full-length nucleotide by standard solid-phase methods at the AUGCT Biotechnology Company (Beijing, China).	PMC5628310	FVPYNPPRPGQSKPFPSFPGHGPFNPK
Bacterial strains and plasmids	1	1	The gene encoding the antibacterial peptide abaecin, with the previously reported sequence FVPYNPPRPGQSKPFPSFPGHGPFNPK IQWPYPLPNPGH,^18 was synthesized using a TEV protease cleavage locus gene, a beta-glucanase mature peptide, and signal peptide gene (gmp and gsp) as a full-length nucleotide by standard solid-phase methods at the AUGCT Biotechnology Company (Beijing, China).	PMC5628310	IQWPYPLPNPGH
Introduction	2	1	Pin2 (FWGALAKGALKLIPSLFSSFSKKD, see table 1) is a 24-residue alpha-helical antimicrobial peptide characterized from the venom of the African scorpion Pandinus imperator, this peptide has antimicrobial activities towards Gram-positive and Gram-negative bacteria in the micromolar range; however, it shows hemolytic activity at similar concentrations [15].	PMC4096598	FWGALAKGALKLIPSLFSSFSKKD
Discussion	2	12	For example, the WSWS peptide RWVSVNGKWISQ has a CD spectrum containing a minimum at 215 nm and a maximum at 229 nm [43].	PMC4096598	RWVSVNGKWISQ
1. Introduction	3	1	Melittin (GIGAVLKVLTTGLPALISWIKRKRQQ-NH_2) is the most studied linear cationic peptide, with a +6 net charge, which adopts an α-helical conformation when inserted into membranes.	PMC7695215	GIGAVLKVLTTGLPALISWIKRKRQQ
Discussion	4	1	The fusion GNT7 consists of the first three rings of nisin and a PRPRPPRRIYNR tail from oncocin.	PMC4745983	PRPRPPRRIYNR
Material and methods; Synthesis of peptides	1	1	The peptide RP1 (ALYKKFKKKLLKSLKRLG-COOH) [36] was synthesized by solid phase peptide synthesis (SPPS) using Fmoc protocols on Wang resin [43].	PMC7098557	ALYKKFKKKLLKSLKRLG
MATERIALS AND METHODS; Characterization of LPcin‐YK3 peptide	1	7	The sequence of the 15 amino acid peptide LPcin‐YK3 (NKVKEWIKYLKSLFS) contains a number of basic lysine (K) residues.	PMC7379261	NKVKEWIKYLKSLFS
1. Introduction	4	2	One such AMPs is the linear undecapeptide BP100 (KKLFKKILKYL-NH2), with bioactivity against E. amylovora.	PMC8069920	KKLFKKILKYL
1. Introduction	4	4	Nevertheless, BP100 has limited activity against Gram-negative bacteria, and to surpass that limitation an analogue was developed, namely, RW-BP100 (RRLFRRILRWL-NH2), which demonstrated improved efficacy against Gram-negative bacteria such as Escherichia coli, Klebsiella pneumoniae, and Pseudomonas aeruginosa, whilst demonstrating efficacy in some Gram-positive bacteria [47].	PMC8069920	RRLFRRILRWL
1. Introduction	4	5	Other AMP reported as effective against Gram-negative bacteria include the cecropin A-melittin (CA-M) hybrid (KWKLFKKIGAVLKVL-NH2) [48,49] and peptide 3.1 (KKLLKWLLKLL-NH2), an LK peptide studied in the last years, with promising results against e.g., Shigella dysenteriae, K. pneumoniae, and E. coli [50,51].	PMC8069920	KWKLFKKIGAVLKVL
1. Introduction	4	5	Other AMP reported as effective against Gram-negative bacteria include the cecropin A-melittin (CA-M) hybrid (KWKLFKKIGAVLKVL-NH2) [48,49] and peptide 3.1 (KKLLKWLLKLL-NH2), an LK peptide studied in the last years, with promising results against e.g., Shigella dysenteriae, K. pneumoniae, and E. coli [50,51].	PMC8069920	KKLLKWLLKLL
1. Introduction	4	6	Another AMP with demonstrated efficacy against Gram-negative Pseudomonas syringae pv. tabaci and Xanthomonas campestris pv. malvacearum bacteria is D4E1 (FKLRAKIKVRLRAKIKL-NH2) [52].	PMC8069920	FKLRAKIKVRLRAKIKL
1. Introduction	5	2	For comparison, we have also included the AMP Dhvar-5 (LLLFLLKKRKKRKY-NH2), widely reported to possess potent action against Gram-positive bacteria like Staphylococcus aureus [53] and which was not tested against E. amylovora before either.	PMC8069920	LLLFLLKKRKKRKY
1. Introduction	4	1	In this study, we discovered a novel temporin from the skin secretions of Pelophylax fukienensis, namely Temporin-PF (TPF: FLPLIAGLFGKIF-NH_2), and observed that TPF tended to aggregate.	PMC8123395	FLPLIAGLFGKIF
4. Materials and Methods; 4.2. Identification of Precursor-Encoding cDNA from the Skin Secretion	1	3	A degenerate sense primer (5′-GAWYYAYYHRAGCCYAAADATG-3′) that was designed according to the highly conserved 5′-untranslated region of temporin encoding mRNA from ranid frogs was employed to conduct 3′-RACE reaction to obtain the full-length open reading frame.	PMC8123395	GAWYYAYYHRAGCCYAAADATG
Results; Purification of BM1122	1	8	The unidentified fragments of TGLTK and VQLIGFGNFEVR might attribute to loss during filtration and elution using manual C18 Tips to desalt after digestion.	PMC6053492	VQLIGFGNFEVR
MATERIALS AND METHODS; DNA sequencing and repetitive element PCR fingerprinting	1	3	The 16S rRNA gene was amplified using the universal primers 11F (5′-TAACACATGCAAGTCGAACG-3′) and 4R (5′-ACGGGCGGTGTGTRC-3′).	PMC9431498	ACGGGCGGTGTGTRC
Materials and methods; Materials	1	1	E2EM-lin (GILDTLKQFAKGVGKDLVKGAAQGVLSTVSCKLAKTC) was supplied by Pepceuticals (UK), synthesised by solid phase synthesis and purified by HPLC to purity greater than 99%, confirmed by MALDI mass spectrometry.	PMC8382640	GILDTLKQFAKGVGKDLVKGAAQGVLSTVSCKLAKTC
2. Families of AMPs and Their Anti-Infectious Activities; 2.8. Eumenitin and Leishmania	1	4	Eumenitin is composed of 15 amino-acids (LNLKGIFKKVASLLT) (Table 1) and is predicted to adopt a linear α-helical structure [65].	PMC8301979	LNLKGIFKKVASLLT
2. Families of AMPs and Their Anti-Infectious Activities; 2.8. Eumenitin and Leishmania	2	2	Furthermore, a study carried out by Rangel et al. reported that both peptides, eumenitin-F (LNLKGLFKKVASLLT) isolated from Eumenes fraterculus and eumenitin-R (LNLKGLIKKVASLLN) isolated from E. rubrofemoratus (Table 1), displayed anti-leishmanial activity against promastigotes of L. major (Table 1) [152,153].	PMC8301979	LNLKGLFKKVASLLT
2. Families of AMPs and Their Anti-Infectious Activities; 2.8. Eumenitin and Leishmania	2	2	Furthermore, a study carried out by Rangel et al. reported that both peptides, eumenitin-F (LNLKGLFKKVASLLT) isolated from Eumenes fraterculus and eumenitin-R (LNLKGLIKKVASLLN) isolated from E. rubrofemoratus (Table 1), displayed anti-leishmanial activity against promastigotes of L. major (Table 1) [152,153].	PMC8301979	LNLKGLIKKVASLLN
Materials and methods; Immunohistochemistry	1	2	The sequence of the synthetic AvBD2 peptide was CPSHLIKVGS and that of the synthetic CATH1 peptide was C-C6-YRAIKKK.	PMC7597731	CPSHLIKVGS
Materials and methods; Immunohistochemistry	2	4	The sections were then washed with PBS (5 min × 3 times) and incubated with the biotin-conjugated anti-rabbit IgG (1:200) and avidin-biotin-peroxidase complex (1:50) for 1 h each using the VECTASTAIN ABC Kit (Vector Laboratories, Inc., Burlingame, CA).	PMC7597731	VECTASTAIN
MATERIALS AND METHODS; Preparation of TP3	1	1	Tilapia pisicidin (FIHHIIGGLFSVGKHIHSLIHGH) was provided by Professor Jyh‐Yih Chen's laboratory (Academia Sinica of Taiwan).	PMC7286473	FIHHIIGGLFSVGKHIHSLIHGH
DISCUSSION	2	5	^6, ^53 The sequence between TP3 (FIHHIIGGLFSVGKHIHSLIHGH) and TP4 (FIHHIIGGLFSAGKAIHRLIRRRRR) is similar and both peptides have amphiphilic, α‐helical, cationic characteristics, suggesting that TP3 may have the potential to treat glioblastoma.	PMC7286473	FIHHIIGGLFSVGKHIHSLIHGH
DISCUSSION	2	5	^6, ^53 The sequence between TP3 (FIHHIIGGLFSVGKHIHSLIHGH) and TP4 (FIHHIIGGLFSAGKAIHRLIRRRRR) is similar and both peptides have amphiphilic, α‐helical, cationic characteristics, suggesting that TP3 may have the potential to treat glioblastoma.	PMC7286473	FIHHIIGGLFSAGKAIHRLIRRRRR
1. Introduction	2	2	The two terminal β-naphthylalanine residues of S1-Nal-Nal (Ac-KKWRKWLAKKNalNal-NH_2) were inserted into the hydrophobic lipid A motif of LPS micelles [6].	PMC7369893	KKWRKWLAKKN
1. Introduction	2	4	Similarly, derivatives with phenylalanine-(Phe-P-113), β-naphthylalanine- (Nal-P-113), β-diphenylalanine-(Dip-P-113), and β-(4,4’-biphenyl)alanine-(Bip-P-113) substituted histidine-rich antimicrobial peptide P-113 (Ac-AKRHHGYKRKFH-NH_2) were developed [6,7].	PMC7369893	AKRHHGYKRKFH
2. Results; 2.6. P-113 and its Derivatives Attenuate Vancomycin-Induced LPS Release	1	3	CLP-19 was derived from the core domain of Limulus anti-LPS factor (LALF; amino acids 31-52) with a sequence of (CHYRIKPTFRRLKWKYKGKFWC) and a head to tail disulfide bond.	PMC7369893	CHYRIKPTFRRLKWKYKGKFWC
2. Results and Discussion; 2.1. Sequence Analysis and AMP Prediction	1	4	By visual inspection and similarity searches in various AMP databases (for review, see Liu et al. [28]), we recognized a cationic region within turgencin A (sequence 18-27, GKKPGGWKCK) with a 4-amino acid central core sequence PGGW (Figure 1) which was found in some abaecins, a well-known family of AMPs found in insects [29].	PMC7432809	GKKPGGWKCK
2. Results and Discussion; 2.1. Sequence Analysis and AMP Prediction	2	6	Out of the 27 sequences analyzed, only one sequence (sequence 18-27, GKKPGGWKAK) was predicted to be antimicrobial by all four models in AMP_R3, including the RF classifier, and by the SVM model in ADAM (Table 1).	PMC7432809	GKKPGGWKAK
2. Results and Discussion; 2.1. Sequence Analysis and AMP Prediction	2	14	Furthermore, the peptide sequence, 18-27 (GKKPGGWKAK), was calculated to have a Boman index of 1.52, the highest among all the predicted peptides, but still in the middle range among AMPs [36].	PMC7432809	GKKPGGWKAK
2. Results and Discussion; 2.1. Sequence Analysis and AMP Prediction	2	18	Based on the above predictions, the C-terminally amidated sequence 18-27 (GKKPGGWKAK; hereafter named StAMP-1) was selected as the first lead peptide to be synthesized, screened for antimicrobial activity, and further optimized employing an amino acid replacement strategy.	PMC7432809	GKKPGGWKAK
3. Materials and Methods; 3.1. Sequence Analysis and Peptide Design	1	8	The peptide sequence with the highest overall predicted AMP score from all models was the sequence GKKPGGWKAK, which became our first lead peptide StAMP-1 and basis for further studies.	PMC7432809	GKKPGGWKAK
Materials and Methods; Immuno-Location of Re-crustin Protein by Western Blot and by Immunohistochemistry; Polyclonal Antiserum	1	1	The chemically synthesized region of Re-crustin (PTRFGGPPQTCSSDSSCTNNYTDK) was coupled to ovalbumin and used for the immunization procedure of two New Zealand White rabbits (Saprophyte Pathogen free) according to the protocol of Covalab™ (France).	PMC7381244	PTRFGGPPQTCSSDSSCTNNYTDK
1. Introduction	1	10	We previously reported Smp24 (IWSFLIKAATKLLPSLFGGGKKDS), a cationic AMP identified from the venom of Scorpio Maurus palmatus with a wide antimicrobial spectrum against various bacteria and fungi [8].	PMC9607800	IWSFLIKAATKLLPSLFGGGKKDS
Novel Antifungal Peptides in Clinical and Preclinical Development; P113	1	1	P113 (also known as PAC-113, PAC113 and P-113) is a synthetic amphipathic, α-helical 12 amino acid histatin 5 derivative (AKRHHGYKRKFH) with membrane-permeabilising activity against Candida spp. (181) and bacteria (182-185).	PMC7533533	AKRHHGYKRKFH
Novel Antifungal Peptides in Clinical and Preclinical Development; Omiganan	1	1	Omiganan (MX-226 or MBI-226) is a synthetic AMP (ILRWPWWPWRRK-amide) derived from indolicidin, originally isolated from bovine neutrophils, with antifungal (200, 201), antibacterial (200, 202), anti-biofilm (203, 204), antiviral (205) and immunomodulatory properties (206).	PMC7533533	ILRWPWWPWRRK
Novel Antifungal Peptides in Clinical and Preclinical Development; Omiganan	1	6	Interestingly, an omiganan analogue with the sequence reversed (KRRWPWWPWRLI-NH_2) was more active against C. albicans (Forward MIC 128 mg/L; Reverse MIC 32-64 mg/L) and both were equally effective against A. niger ATCC16404 (MIC 64 mg/L) (207).	PMC7533533	KRRWPWWPWRLI
Novel Antifungal Peptides in Clinical and Preclinical Development; hLF1-11	1	1	The AMP hLF1-11 (GRRRRSVQWCA) comprises the first 11 amino acids of human lactoferrin and is a multi-functional peptide with antibacterial activity (185, 210, 211), antifungal activity (212) and immunomodulatory properties (213, 214). hLF1-11 demonstrated antifungal activity in vitro against C. albicans (MIC 22-44 mg/L; n = 11), including oral and vaginal isolates (212, 215).	PMC7533533	GRRRRSVQWCA
Results; Sequence analyses of DAAO	2	3	The highest AS was found for a 33-residues long peptide starting at position 257 (^257IWKSCCKLEPTLKNARIVGELTGFRPVRPQVRL^289, named IWK, corresponding to ^259IWEGCCKLEPTLKNARIIGERTGFRPVRPQIRL^291 in the human enzyme): the AS value for this peptide is higher than two of the three threshold scores, Supplementary Fig 1.	PMC8038955	IWKSCCKLEPTLKNARIVGELTGFRPVRPQVRL
Results; Sequence analyses of DAAO	2	3	The highest AS was found for a 33-residues long peptide starting at position 257 (^257IWKSCCKLEPTLKNARIVGELTGFRPVRPQVRL^289, named IWK, corresponding to ^259IWEGCCKLEPTLKNARIIGERTGFRPVRPQIRL^291 in the human enzyme): the AS value for this peptide is higher than two of the three threshold scores, Supplementary Fig 1.	PMC8038955	IWEGCCKLEPTLKNARIIGERTGFRPVRPQIRL
Results; Sequence analyses of DAAO	2	4	At the C terminus of DAAO, an additional region showed two relative maxima with AS = 4.5 (for the 22 residue window) and AS = 3.3 (for the 33 residue window) corresponding to peptides ^324AANLFGKILEEKKLSRLPPSHL^345 and ^313GLTIHWGCAMEAANLFGKILEEKKLSRLPPSHL^345, respectively.	PMC8038955	AANLFGKILEEKKLSRLPPSHL
Results; Sequence analyses of DAAO	2	4	At the C terminus of DAAO, an additional region showed two relative maxima with AS = 4.5 (for the 22 residue window) and AS = 3.3 (for the 33 residue window) corresponding to peptides ^324AANLFGKILEEKKLSRLPPSHL^345 and ^313GLTIHWGCAMEAANLFGKILEEKKLSRLPPSHL^345, respectively.	PMC8038955	GLTIHWGCAMEAANLFGKILEEKKLSRLPPSHL
Results; Sequence analyses of DAAO	2	5	Even if the score of these peptides is below the threshold, we selected peptide 313-345 (named GLT and corresponding to ^315GLTIHWGCALEAAKLFGRILEEKKLSRMPPSHL^347 in the human enzyme) for further characterization, because in the crystal structure of DAAO, this region is structured as a long and amphipathic α-helix, a feature often associated with CAMPs.	PMC8038955	GLTIHWGCALEAAKLFGRILEEKKLSRMPPSHL
Methods; Antibacterial peptides	1	2	Putative antimicrobial peptides identified inside the sequence of mouse DAAO, ^257IWKSCCKLEPTLKNARIVGELTGFRPVRPQVRL^289 (IWK) and ^313GLTIHWGCAMEAANLFGKILEEKKLSRLPPSHL^345 (GLT) were synthesized by Aurogene s.r.l.	PMC8038955	IWKSCCKLEPTLKNARIVGELTGFRPVRPQVRL
Methods; Antibacterial peptides	1	2	Putative antimicrobial peptides identified inside the sequence of mouse DAAO, ^257IWKSCCKLEPTLKNARIVGELTGFRPVRPQVRL^289 (IWK) and ^313GLTIHWGCAMEAANLFGKILEEKKLSRLPPSHL^345 (GLT) were synthesized by Aurogene s.r.l.	PMC8038955	GLTIHWGCAMEAANLFGKILEEKKLSRLPPSHL
Methods; Antibacterial peptides	1	3	(Roma, Italy), and the ^268LKNARIVGELTGFRPVRPQVRLE^290 (LKN), ^323EAANLGGKILEEKKLSRLPPSHL^345 (EAA), and ^315TIHWGCAMEAANLFGKILEEKKLSRLPPSHL^345 (TIH) by Microtech s.r.l.	PMC8038955	LKNARIVGELTGFRPVRPQVRLE
Methods; Antibacterial peptides	1	3	(Roma, Italy), and the ^268LKNARIVGELTGFRPVRPQVRLE^290 (LKN), ^323EAANLGGKILEEKKLSRLPPSHL^345 (EAA), and ^315TIHWGCAMEAANLFGKILEEKKLSRLPPSHL^345 (TIH) by Microtech s.r.l.	PMC8038955	EAANLGGKILEEKKLSRLPPSHL
