section	paragraph	sentence	text	pmcid	matched_sequence
Materials and Methods; E. coli Filamentation Assay for Testing in vivo Inhibition of DNA Synthesis by Peptides	1	3	Peptide mixed with water was used as negative control, and the Trp-rich AMP indolicidin (ILPWKWPWWPWRR-NH_2) was used as a positive control due to its known filamentation effect [42].	PMC3788796	ILPWKWPWWPWRR
Results; Selective Permeabilisation of Negatively Charged Vesicles by PINA-based Peptides	1	1	The peptides PuroA (FPVTWRWWKWWKG-NH_2) (designed based on the TRD of the wild-type PINA), Pina-M (FSVTWRWWKWWKG-NH_2) (designed based on a natural hard wheat mutant), and Pina-W→F (FPVTFRFFKFFKG-NH_2) (with all Trps substituted with Phe), were found to exhibit the strongest inhibitory activities against bacteria and phytopathogenic fungi amongst a number of peptides tested earlier [18].	PMC3788796	FPVTWRWWKWWKG
Results; Selective Permeabilisation of Negatively Charged Vesicles by PINA-based Peptides	1	1	The peptides PuroA (FPVTWRWWKWWKG-NH_2) (designed based on the TRD of the wild-type PINA), Pina-M (FSVTWRWWKWWKG-NH_2) (designed based on a natural hard wheat mutant), and Pina-W→F (FPVTFRFFKFFKG-NH_2) (with all Trps substituted with Phe), were found to exhibit the strongest inhibitory activities against bacteria and phytopathogenic fungi amongst a number of peptides tested earlier [18].	PMC3788796	FSVTWRWWKWWKG
Results; Selective Permeabilisation of Negatively Charged Vesicles by PINA-based Peptides	1	1	The peptides PuroA (FPVTWRWWKWWKG-NH_2) (designed based on the TRD of the wild-type PINA), Pina-M (FSVTWRWWKWWKG-NH_2) (designed based on a natural hard wheat mutant), and Pina-W→F (FPVTFRFFKFFKG-NH_2) (with all Trps substituted with Phe), were found to exhibit the strongest inhibitory activities against bacteria and phytopathogenic fungi amongst a number of peptides tested earlier [18].	PMC3788796	FPVTFRFFKFFKG
Introduction	1	3	[3]− [5] Protegrin-1 (PG-1 RGGRLCYCRRRFCVCVGR-NH_2) is a remarkably potent, naturally occurring cationic AMP, which has 18 amino acid residues and forms a β-hairpin structure (Figure 1).	PMC6026836	RGGRLCYCRRRFCVCVGR
4. Materials and Methods; 4.4. Synthesise of the ZM-804 Peptide	1	1	The ZM-804 (LARLRRLCFLWAAAWPWPWR) peptide was synthesized in a 9-fluorenyl methoxycarbonyl (Fmoc) solid-phase method by GenScript^® Corporation (Piscataway, NJ, USA).	PMC7961353	LARLRRLCFLWAAAWPWPWR
4. Materials and Methods; 4.5. Synthesis of LvALF8-LBD	1	2	The amino acid residue of LvALF8-LBD, Ac-(CSYSTRPYFLRWRLKFKSKVWC)-NH_2, was amidated in the C-terminal and acetylated in the N-terminal.	PMC8145222	CSYSTRPYFLRWRLKFKSKVWC
4. Materials and Methods; 4.5. Synthesis of LvALF8-LBD	1	5	The LBD peptide of FcALF8-LBD, Ac-(CSYSTRPYFIRWQLKFKTKIWC)-NH_2, was synthesized for comparison analysis.	PMC8145222	CSYSTRPYFIRWQLKFKTKIWC
4. Materials and Methods; 4.5. Synthesis of LvALF8-LBD	1	6	A partial peptide of Green Fluorescent Protein (GFP) (Accession number: AAN41637), Ac-(TTGKLPVPWPTLVTTFSYGVQCFS)-NH_2, was included as a negative control.	PMC8145222	TTGKLPVPWPTLVTTFSYGVQCFS
Introduction	1	1	The antimicrobial peptide Polybia-MP1 (IDWKKLLDAAKQIL-NH2), or simply MP1, has unexpectedly been shown to exhibit selective inhibition against several types of cancerous cells and therefore could prove advantageous in the development of novel chemotherapies.	PMC4564682	IDWKKLLDAAKQIL
Materials and Methods; Preparation of the anti-Thi2.4 antibody	1	1	The anti-Thi2.4 antibody was raised in a rabbit against the oligopeptide CPSQSTRKEFED of the Thi2.4 protein.	PMC3749967	CPSQSTRKEFED
2. Results; 2.1. Design and Synthesis of NCR335 and NCR169 Peptide Derivatives	1	1	NCR335 is not only one of the most cationic NCR peptides but it is exceptional due to its 64 amino acid (RLNTTFRPLNFKMLRFWGQNRNIMKHRGQKVHFSLILSDCKTNKDCPKLRRANVRCRKSYCVPI) long sequence compared to the average length of 33 amino acids of NCRs.	PMC8037406	RLNTTFRPLNFKMLRFWGQNRNIMKHRGQKVHFSLILSDCKTNKDCPKLRRANVRCRKSY
2. Results; 2.1. Design and Synthesis of NCR335 and NCR169 Peptide Derivatives	1	3	The 31 amino acid long N-terminal sequence (RLNTTFRPLNFKMLRFWGQNRNIMKHRGQKV) is unrelated to the NCR sequences and lacks cysteine residues but has +8.1 net charge and pI: 12.72, which raised the possibility that this sequence may also have antimicrobial activity.	PMC8037406	RLNTTFRPLNFKMLRFWGQNRNIMKHRGQKV
2. Results; 2.1. Design and Synthesis of NCR335 and NCR169 Peptide Derivatives	2	1	In the case of NCR169 (EDIGHIKYCGIVDDCYKSKKPLFKIWKCVENVCVLWYK), we investigated the C-terminal 22 amino acid long sequence (KSKKPLFKIWKCVENVCVLWYK), NCR169C_17-38, with a net charge of +5.9 and a pI of 10.48 in linear and a net charge of +6 and a pI of 11.01 in oxidized form, and by replacing the two tryptophan residues (W_10 and W_20) with alanine (Table 1).	PMC8037406	EDIGHIKYCGIVDDCYKSKKPLFKIWKCVENVCVLWYK
2. Results; 2.1. Design and Synthesis of NCR335 and NCR169 Peptide Derivatives	2	1	In the case of NCR169 (EDIGHIKYCGIVDDCYKSKKPLFKIWKCVENVCVLWYK), we investigated the C-terminal 22 amino acid long sequence (KSKKPLFKIWKCVENVCVLWYK), NCR169C_17-38, with a net charge of +5.9 and a pI of 10.48 in linear and a net charge of +6 and a pI of 11.01 in oxidized form, and by replacing the two tryptophan residues (W_10 and W_20) with alanine (Table 1).	PMC8037406	KSKKPLFKIWKCVENVCVLWYK
Materials and methods; Synthesis of peptides	1	1	Melimine (amino acid sequence: TLISWIKNKRKQRPRVSRRRRRRGGRRRR; molecular mass 3786.6) and Mel4 (KNKRKRRRRRRGGRRRR; 2347.8) were synthesized by conventional solid-phase peptide protocols [40, 41] and procured from the Auspep Peptide Company (Tullamarine, Victoria, Australia).	PMC6663011	TLISWIKNKRKQRPRVSRRRRRRGGRRRR
Materials and methods; Synthesis of peptides	1	1	Melimine (amino acid sequence: TLISWIKNKRKQRPRVSRRRRRRGGRRRR; molecular mass 3786.6) and Mel4 (KNKRKRRRRRRGGRRRR; 2347.8) were synthesized by conventional solid-phase peptide protocols [40, 41] and procured from the Auspep Peptide Company (Tullamarine, Victoria, Australia).	PMC6663011	KNKRKRRRRRRGGRRRR
1. Introduction	5	1	Recently, we identified two N-terminal derivatives of the frog skin AMP esculentin-1a, esculentin-1a(1-21)NH_2 [Esc(1-21) GIFSKLAGKKIKNLLISGLKG-NH_2] and its diastereomer Esc(1-21)-1c carrying d-Leu14 and d-Ser17 (Esc peptides), with potent in vitro and in vivo activity against both the free living and biofilm form of P. aeruginosa [23,24,25].	PMC7826692	GIFSKLAGKKIKNLLISGLKG
Abstract	1	1	The linear undecapeptide KKLFKKILKYL-NH2 (BP100) highlights for its antibacterial activity against Gram-negative bacteria and its low toxicity.	PMC10970450	KKLFKKILKYL
1. Introduction	4	2	In 2006, we identified the linear undecapeptide KKLFKKILKYL-NH_2 (BP100) with high activity against these bacteria, while its haemolysis and phytotoxicity were low [10].	PMC10970450	KKLFKKILKYL
3. Mechanistic Studies on BP100 Derivatives	1	7	Castanho and coworkers studied the activity against Gram-negative and Gram-positive bacteria as well as the mechanistic features of two BP100 analogues: R-BP100 (RRLFRRILRYL-NH_2) and RW-BP100 (RRLFRRILRWL-NH_2) [38].	PMC10970450	RRLFRRILRYL
3. Mechanistic Studies on BP100 Derivatives	1	7	Castanho and coworkers studied the activity against Gram-negative and Gram-positive bacteria as well as the mechanistic features of two BP100 analogues: R-BP100 (RRLFRRILRYL-NH_2) and RW-BP100 (RRLFRRILRWL-NH_2) [38].	PMC10970450	RRLFRRILRWL
3. Mechanistic Studies on BP100 Derivatives	2	2	Gameiro [39,40] studied the antibacterial activity and the biophysical properties of W-BP100 (WKKLFKKILKYL-NH_2), incorporating an additional tryptophan residue at the N-terminus.	PMC10970450	WKKLFKKILKYL
Materials and Methods; Preparation and analysis of synthetic antimicrobial peptides	1	2	Sequences of the synthetic peptides are as follows: bCAT (bCgA_344-364: RSMRLSFRARGYGFRGPGLQL), hCAT (hCgA_352-372: SSMKLSFRARGYGFRGPGPQL), bCTL (bCgA344-358: RSMRLSFRARGYGFR) and LL-37 (hCAP_134-170 LLGDFFRKSKEKIGKEFKRIVQRIKDFLRNLVPRTES).	PMC3722296	RSMRLSFRARGYGFRGPGLQL
Materials and Methods; Preparation and analysis of synthetic antimicrobial peptides	1	2	Sequences of the synthetic peptides are as follows: bCAT (bCgA_344-364: RSMRLSFRARGYGFRGPGLQL), hCAT (hCgA_352-372: SSMKLSFRARGYGFRGPGPQL), bCTL (bCgA344-358: RSMRLSFRARGYGFR) and LL-37 (hCAP_134-170 LLGDFFRKSKEKIGKEFKRIVQRIKDFLRNLVPRTES).	PMC3722296	SSMKLSFRARGYGFRGPGPQL
Materials and Methods; Preparation and analysis of synthetic antimicrobial peptides	1	2	Sequences of the synthetic peptides are as follows: bCAT (bCgA_344-364: RSMRLSFRARGYGFRGPGLQL), hCAT (hCgA_352-372: SSMKLSFRARGYGFRGPGPQL), bCTL (bCgA344-358: RSMRLSFRARGYGFR) and LL-37 (hCAP_134-170 LLGDFFRKSKEKIGKEFKRIVQRIKDFLRNLVPRTES).	PMC3722296	RSMRLSFRARGYGFR
Materials and Methods; Preparation and analysis of synthetic antimicrobial peptides	1	2	Sequences of the synthetic peptides are as follows: bCAT (bCgA_344-364: RSMRLSFRARGYGFRGPGLQL), hCAT (hCgA_352-372: SSMKLSFRARGYGFRGPGPQL), bCTL (bCgA344-358: RSMRLSFRARGYGFR) and LL-37 (hCAP_134-170 LLGDFFRKSKEKIGKEFKRIVQRIKDFLRNLVPRTES).	PMC3722296	LLGDFFRKSKEKIGKEFKRIVQRIKDFLRNLVPRTES
Discussion	4	6	Structure activity relationship of CTL with bacterial membrane is also demonstrated by recent experiments concerning the CTL derived peptide with a hydrophobic N-terminal end FLE-CTL (FLE-RSMRLSFRARGYGFR) (5R).	PMC3722296	RSMRLSFRARGYGFR
Discussion	4	8	In contrast, the shorter peptide that is lacking the C-terminal end (YGFR) of CTL: FLE-RSMRLSFRARG, displays antibacterial activities at 200 µg/mL (data not shown).	PMC3722296	RSMRLSFRARG
2. Results; 2.1. Peptide Synthesis and Purification	1	1	HJH-1 (KLLKHKLLVTLA) contains 12 amino acid residues, and its theoretical isoelectric point was 10.30.	PMC6222697	KLLKHKLLVTLA
4. Materials and Methods; 4.1. Peptide Synthesis	1	1	HJH-1 (KLLKHKLLVTLA) was prepared via solid-phase synthesis using 9-fluorenylmethoxycarbonyl (F-moc) chemistry by Tribute polypeptide synthesizer (Proteintech Group, Inc., Cook County, IL, USA), according to the manufacturer’s protocol [26].	PMC6222697	KLLKHKLLVTLA
Introduction	3	1	Melittin is α-helical, cationic and amphiphilic peptide that consists of 26 amino acids (NH_2-GIGAVLKVLTTGLPALISWIKRKRQQ-CONH_2).	PMC6658469	GIGAVLKVLTTGLPALISWIKRKRQQ
Introduction	2	3	The peptide investigated, BPC194: c(KKLKKFKKLQ), is a cyclic antimicrobial peptide that adopts a β-sheet structure upon interaction with the membrane [23].	PMC3631201	KKLKKFKKLQ
Materials and Methods; Reagents and Apparatus	1	6	The peptides BPC194, c(KKLKKFKKLQ), and its linear counterpart BPC193, H-KKLKKFKKLQ-OH, were synthesized as described previously (23) and purified by reverse-phase preparative HPLC (purities >95%).	PMC3631201	KKLKKFKKLQ
Materials and Methods; Reagents and Apparatus	1	6	The peptides BPC194, c(KKLKKFKKLQ), and its linear counterpart BPC193, H-KKLKKFKKLQ-OH, were synthesized as described previously (23) and purified by reverse-phase preparative HPLC (purities >95%).	PMC3631201	KKLKKFKKLQ
Materials and methods; Microorganisms and reagents	1	1	CGA-N12 (H-ALQGAKERAHQQ-OH) was synthesized using a solid-phase method and purified by high-performance liquid chromatography.	PMC7225414	ALQGAKERAHQQ
RESULTS; Antibacterial spectrum of Intestinalin (P30)	1	1	Previously, we tested the LysC autolysin from Clostridium intestinale URNW (GenBank ERK30183.1) and the peptide Intestinalin (P30) derived from the LysC N-terminal region (amino acid sequence KNLLRRIRRKLRNKFSRSDVIKTPKIVEVN) against Staphylococcus aureus ATCC 25923 (19).	PMC9602519	KNLLRRIRRKLRNKFSRSDVIKTPKIVEVN
RESULTS; Intestinalin (P10) targets the bacterial cell membrane	2	3	Therefore, proton signals of the Intestinalin (P10)_SDS peptide (LysC_2-12; sequence, KNLLRRIRRK) were assigned based on total correlation spectroscopy (TOCSY) spectra, and the sequential analysis was confirmed by rotating-frame Overhauser effect spectroscopy (ROESY).	PMC9602519	KNLLRRIRRK
MATERIALS AND METHODS; Determination of membrane potential	1	9	The APLP peptide (sequence, RVGGLEEERESVGPLRE; APLP peptide has no antibacterial activity and is a part of human amyloid-like protein 2, which has been implicated in the pathogenesis of Alzheimer's disease) was provided by the Department of Biomedical Chemistry, Faculty of Chemistry, University of Gdansk, Gdansk, Poland.	PMC9602519	RVGGLEEERESVGPLRE
4. Materials and Methods; 4.2. Peptide Synthesis	1	1	The C14R peptide NH_2-CSSGSLWRLIRRFLRR was synthesized automatically on a 0.10 mmol scale using standard Fmoc solid-phase peptide synthesis techniques with a microwave synthesizer (CEM Corporation, Matthews, NC, USA).	PMC10820675	CSSGSLWRLIRRFLRR
"Results and Discussion; XCL1
Lacks a Membrane Active α-Helix"	2	8	[13] The individual α-helical sequence for CCL20 scored slightly higher than the CXCL4 α-helix (TWVKYIVRLLSK, σ = 1.0, P = 0.97; PLYKKIIKKLLE, σ = 0.72, P = 0.92, respectively), whereas the XCL1 α-helix scored significantly lower (TWVRDVVRSMDRK, σ = 0.13, P = 0.61).	PMC7258946	TWVKYIVRLLSK
"Results and Discussion; XCL1
Lacks a Membrane Active α-Helix"	2	8	[13] The individual α-helical sequence for CCL20 scored slightly higher than the CXCL4 α-helix (TWVKYIVRLLSK, σ = 1.0, P = 0.97; PLYKKIIKKLLE, σ = 0.72, P = 0.92, respectively), whereas the XCL1 α-helix scored significantly lower (TWVRDVVRSMDRK, σ = 0.13, P = 0.61).	PMC7258946	PLYKKIIKKLLE
"Results and Discussion; XCL1
Lacks a Membrane Active α-Helix"	2	8	[13] The individual α-helical sequence for CCL20 scored slightly higher than the CXCL4 α-helix (TWVKYIVRLLSK, σ = 1.0, P = 0.97; PLYKKIIKKLLE, σ = 0.72, P = 0.92, respectively), whereas the XCL1 α-helix scored significantly lower (TWVRDVVRSMDRK, σ = 0.13, P = 0.61).	PMC7258946	TWVRDVVRSMDRK
2. Results; 2.1. C-15867 ab Initio Modeling	1	1	The C-15867 peptide sequence, VTCDLLKPFFGRAPCMMHCILRFKKRTGFCSRQNVCVCR, was identified in the Hermetia illucens insect through a combination of transcriptomics and bioinformatics approaches [43].	PMC8929087	VTCDLLKPFFGRAPCMMHCILRFKKRTGFCSRQNVCVCR
Abstract	1	4	In this work, an antimicrobial peptide, RRPRPRPRPWWWW-NH2 (RRP9W4N), was covalently attached to amphiphilic and ordered mesoporous Pluronic F127 hydrogels made of cross-linked lyotropic liquid crystals through 1-ethyl-3-(3-(dimethylamino)propyl) carbodiimide (EDC) and N-hydroxysuccinimide (NHS) chemistry.	PMC8153390	RRPRPRPRPWWWW
Introduction	8	1	In this work, we developed an antimicrobial hydrogel by covalent immobilization of a cationic AMP, RRPRPRPRPWWWW-NH2 (RRP9W4N), onto ordered amphiphilic mesoporous hydrogels made of cross-linked Pluronic F127 triblock copolymer and water.	PMC8153390	RRPRPRPRPWWWW
Materials and Methods; AMP Immobilization on Hydrogels	1	1	A solution of antimicrobial peptide (AMP) RRPRPRPRPWWWW-NH2 (RRP9W4N, Red Glead Discovery AB, Lund, Sweden) was prepared in sterilized water to a final concentration of 200 μM.	PMC8153390	RRPRPRPRPWWWW
Materials and Methods; Peptides, Antibiotics, and Bacterial Strains	1	1	The peptides Sphistin (AGGKAGKDSGKSKAKAVSRSARAGLQFPVGRIHRHLK; molecular mass, 3828.48 Da) and Sph_12−38 (KAKAKAVSRSARAGLQFPVGRIHRHLK; molecular mass, 2983.59 Da) were all synthesized by Shanghai Glory Chemistry Co., Ltd., and the purity of these two peptides reached 98.88% and 98.68%, respectively.	PMC7645104	AGGKAGKDSGKSKAKAVSRSARAGLQFPVGRIHRHLK
Materials and Methods; Peptides, Antibiotics, and Bacterial Strains	1	1	The peptides Sphistin (AGGKAGKDSGKSKAKAVSRSARAGLQFPVGRIHRHLK; molecular mass, 3828.48 Da) and Sph_12−38 (KAKAKAVSRSARAGLQFPVGRIHRHLK; molecular mass, 2983.59 Da) were all synthesized by Shanghai Glory Chemistry Co., Ltd., and the purity of these two peptides reached 98.88% and 98.68%, respectively.	PMC7645104	KAKAKAVSRSARAGLQFPVGRIHRHLK
Methods; Peptides, bacterial strains, and culture conditions	1	1	CecA is 39 amino acids long (KWKIFKKIEKAGRNIRDGIIKAGPAVSVVGEAATIYKTG) and was synthesized by Pepmic, Jiangsu, China.	PMC7016129	KWKIFKKIEKAGRNIRDGIIKAGPAVSVVGEAATIYKTG
Materials and Methods; Cells and Reagents Used	2	1	SSTP1 (FLPLLISALTSLFPKLGK) and SSTP2 (FLPRRISARTSLFPKRGK-NH_2) were synthesized from SynPeptide Co.	PMC8639500	FLPLLISALTSLFPKLGK
Materials and Methods; Cells and Reagents Used	2	1	SSTP1 (FLPLLISALTSLFPKLGK) and SSTP2 (FLPRRISARTSLFPKRGK-NH_2) were synthesized from SynPeptide Co.	PMC8639500	FLPRRISARTSLFPKRGK
2 Materials and methods; 2.1 Peptide synthesis	1	1	Polydim-I (AVAGEKLWLLPHLLKMLLTPTP-_NH2; m/z 2441.7 [M+H]^+) was synthesized using Fmoc chemistry by AminoTech P & D (Sao Paulo, Brazil).	PMC5453574	AVAGEKLWLLPHLLKMLLTPTP
2. Materials and Methods; 2.1. Synthetic Lipid Systems and Peptide Structure Prediction	2	1	Peptides LL-37 (LLGDFFRKSKEKIGKEFKRIVQRIKDFLRNLVPRTES, Lot.	PMC10051595	LLGDFFRKSKEKIGKEFKRIVQRIKDFLRNLVPRTES
2. Materials and Methods; 2.1. Synthetic Lipid Systems and Peptide Structure Prediction	2	2	V1440EE070/PE1324) and ATRA-1 (KRFKKFFKKLK-NH_2, Lot.	PMC10051595	KRFKKFFKKLK
Materials and Methods; Peptide Synthesis and Evaluation of Antibacterial Activity	1	1	Peptides corresponding to the predicted antimicrobial regions of ModoCath1 (ΔModoCath1, N-VKRTKRGARRGL TKVLKKIFGSIVKKAVSKGV-C), ModoCath5 (ΔModoCath5, N-WYQLIRTFGNLIHQKYRKLLEAYRKLRD-C), ModoCath6 (ΔModoCath6, N-VRRSKRGIKVPSFVKKVLKDVVSESIS-C) and PMAP36 (N-GRFRRLRKKTRKRLKKIGKVLKWIPPIVGSI PLGCG-C) were synthesized via solid-phase peptide synthesis and purified via high-performance liquid chromatography using a commercial service (GenScript, Piscataway Township, NJ, United States).	PMC7063992	VKRTKRGARRGL
Materials and Methods; Peptide Synthesis and Evaluation of Antibacterial Activity	1	1	Peptides corresponding to the predicted antimicrobial regions of ModoCath1 (ΔModoCath1, N-VKRTKRGARRGL TKVLKKIFGSIVKKAVSKGV-C), ModoCath5 (ΔModoCath5, N-WYQLIRTFGNLIHQKYRKLLEAYRKLRD-C), ModoCath6 (ΔModoCath6, N-VRRSKRGIKVPSFVKKVLKDVVSESIS-C) and PMAP36 (N-GRFRRLRKKTRKRLKKIGKVLKWIPPIVGSI PLGCG-C) were synthesized via solid-phase peptide synthesis and purified via high-performance liquid chromatography using a commercial service (GenScript, Piscataway Township, NJ, United States).	PMC7063992	TKVLKKIFGSIVKKAVSKGV
Materials and Methods; Peptide Synthesis and Evaluation of Antibacterial Activity	1	1	Peptides corresponding to the predicted antimicrobial regions of ModoCath1 (ΔModoCath1, N-VKRTKRGARRGL TKVLKKIFGSIVKKAVSKGV-C), ModoCath5 (ΔModoCath5, N-WYQLIRTFGNLIHQKYRKLLEAYRKLRD-C), ModoCath6 (ΔModoCath6, N-VRRSKRGIKVPSFVKKVLKDVVSESIS-C) and PMAP36 (N-GRFRRLRKKTRKRLKKIGKVLKWIPPIVGSI PLGCG-C) were synthesized via solid-phase peptide synthesis and purified via high-performance liquid chromatography using a commercial service (GenScript, Piscataway Township, NJ, United States).	PMC7063992	WYQLIRTFGNLIHQKYRKLLEAYRKLRD
Materials and Methods; Peptide Synthesis and Evaluation of Antibacterial Activity	1	1	Peptides corresponding to the predicted antimicrobial regions of ModoCath1 (ΔModoCath1, N-VKRTKRGARRGL TKVLKKIFGSIVKKAVSKGV-C), ModoCath5 (ΔModoCath5, N-WYQLIRTFGNLIHQKYRKLLEAYRKLRD-C), ModoCath6 (ΔModoCath6, N-VRRSKRGIKVPSFVKKVLKDVVSESIS-C) and PMAP36 (N-GRFRRLRKKTRKRLKKIGKVLKWIPPIVGSI PLGCG-C) were synthesized via solid-phase peptide synthesis and purified via high-performance liquid chromatography using a commercial service (GenScript, Piscataway Township, NJ, United States).	PMC7063992	VRRSKRGIKVPSFVKKVLKDVVSESIS
Materials and Methods; Peptide Synthesis and Evaluation of Antibacterial Activity	1	1	Peptides corresponding to the predicted antimicrobial regions of ModoCath1 (ΔModoCath1, N-VKRTKRGARRGL TKVLKKIFGSIVKKAVSKGV-C), ModoCath5 (ΔModoCath5, N-WYQLIRTFGNLIHQKYRKLLEAYRKLRD-C), ModoCath6 (ΔModoCath6, N-VRRSKRGIKVPSFVKKVLKDVVSESIS-C) and PMAP36 (N-GRFRRLRKKTRKRLKKIGKVLKWIPPIVGSI PLGCG-C) were synthesized via solid-phase peptide synthesis and purified via high-performance liquid chromatography using a commercial service (GenScript, Piscataway Township, NJ, United States).	PMC7063992	GRFRRLRKKTRKRLKKIGKVLKWIPPIVGSI
1. Introduction	7	4	The LHITDMAWKR and ITDFGIFIGL sequences were used as amyloidogenic fragments.	PMC8469417	LHITDMAWKR
1. Introduction	7	4	The LHITDMAWKR and ITDFGIFIGL sequences were used as amyloidogenic fragments.	PMC8469417	ITDFGIFIGL
1. Introduction	7	5	Interestingly, although both of these sequences were predicted to be amyloidogenic, only the ITDFGIFIGL peptide exhibited amyloid-like properties according to electron microscopy and fluorescence of thioflavin T (ThT) under the condition studied [51].	PMC8469417	ITDFGIFIGL
1. Introduction	7	6	In this paper, we tested the antimicrobial properties of the RKKRRQRRRGGGGLHITDMAWKR (R23R) and RKKRRQRRRGGGGITDFGIFIGL (R23L) peptides, as well as their analogs RKKRRQRRRGG-Sar-GLHITD-Nle-AWKR (R23R*) and RKKRRQRRRGG-Sar-GITDFGIFIGL (R23L*) to determine the possible effects associated with the replacement of glycine with sarcosine.	PMC8469417	RKKRRQRRRGGGGLHITDMAWKR
1. Introduction	7	6	In this paper, we tested the antimicrobial properties of the RKKRRQRRRGGGGLHITDMAWKR (R23R) and RKKRRQRRRGGGGITDFGIFIGL (R23L) peptides, as well as their analogs RKKRRQRRRGG-Sar-GLHITD-Nle-AWKR (R23R*) and RKKRRQRRRGG-Sar-GITDFGIFIGL (R23L*) to determine the possible effects associated with the replacement of glycine with sarcosine.	PMC8469417	RKKRRQRRRGGGGITDFGIFIGL
1. Introduction	7	6	In this paper, we tested the antimicrobial properties of the RKKRRQRRRGGGGLHITDMAWKR (R23R) and RKKRRQRRRGGGGITDFGIFIGL (R23L) peptides, as well as their analogs RKKRRQRRRGG-Sar-GLHITD-Nle-AWKR (R23R*) and RKKRRQRRRGG-Sar-GITDFGIFIGL (R23L*) to determine the possible effects associated with the replacement of glycine with sarcosine.	PMC8469417	RKKRRQRRRGG
1. Introduction	7	6	In this paper, we tested the antimicrobial properties of the RKKRRQRRRGGGGLHITDMAWKR (R23R) and RKKRRQRRRGGGGITDFGIFIGL (R23L) peptides, as well as their analogs RKKRRQRRRGG-Sar-GLHITD-Nle-AWKR (R23R*) and RKKRRQRRRGG-Sar-GITDFGIFIGL (R23L*) to determine the possible effects associated with the replacement of glycine with sarcosine.	PMC8469417	RKKRRQRRRGG
1. Introduction	7	6	In this paper, we tested the antimicrobial properties of the RKKRRQRRRGGGGLHITDMAWKR (R23R) and RKKRRQRRRGGGGITDFGIFIGL (R23L) peptides, as well as their analogs RKKRRQRRRGG-Sar-GLHITD-Nle-AWKR (R23R*) and RKKRRQRRRGG-Sar-GITDFGIFIGL (R23L*) to determine the possible effects associated with the replacement of glycine with sarcosine.	PMC8469417	GITDFGIFIGL
2. Results; 2.2. Experimental Validation of the Antibacterial Activity of Peptides; 2.2.1. Determination of the Antibacterial Activity of Peptides on Agar	7	1	It should be noted that the RKKRRQRRRGG-Sar (R12-Sar) peptide itself did not exhibit antimicrobial activity at the concentrations used (see Tables S1 and S2 and Figure S1).	PMC8469417	RKKRRQRRRGG
3. Discussions	9	1	As discussed in the Introduction, the R23L and R23L* peptides were developed based on the amyloidogenic sequence ITDFGIFIGL, which forms amyloid-like fibrils, while R23R and R23R* did contain amyloidogenic sequence, however they failed to identify amyloidogenic properties through their conducted studies [51].	PMC8469417	ITDFGIFIGL
4. Materials and Methods; 4.1. Synthesis and Characterization of Peptides; 4.1.1. Peptide Synthesis	1	1	Peptides RKKRRQRRRGGGGLHITDMAWKR (R23R, 2820.3 Da) and RKKRRQRRRGGGGITDFGIFIGL (R23L, 2645.1 Da) were commercial products (IQ Chemical LLC, S.	PMC8469417	RKKRRQRRRGGGGLHITDMAWKR
4. Materials and Methods; 4.1. Synthesis and Characterization of Peptides; 4.1.1. Peptide Synthesis	1	1	Peptides RKKRRQRRRGGGGLHITDMAWKR (R23R, 2820.3 Da) and RKKRRQRRRGGGGITDFGIFIGL (R23L, 2645.1 Da) were commercial products (IQ Chemical LLC, S.	PMC8469417	RKKRRQRRRGGGGITDFGIFIGL
4. Materials and Methods; 4.1. Synthesis and Characterization of Peptides; 4.1.1. Peptide Synthesis	1	3	Peptides RKKRRQRRRGG-Sar-GLHITD-Nle-AWKR (R23R*, 2815.3 Da), RKKRRQRRRGG-Sar-GITDFGIFIGL (R23L*, 2658.1 Da), and RKKRRQRRRGG-Sar (R12-Sar, 1523.8 Da) were synthesized in-house using routine techniques of Fmoc/^tBu SPPS methodology [61].	PMC8469417	RKKRRQRRRGG
4. Materials and Methods; 4.1. Synthesis and Characterization of Peptides; 4.1.1. Peptide Synthesis	1	3	Peptides RKKRRQRRRGG-Sar-GLHITD-Nle-AWKR (R23R*, 2815.3 Da), RKKRRQRRRGG-Sar-GITDFGIFIGL (R23L*, 2658.1 Da), and RKKRRQRRRGG-Sar (R12-Sar, 1523.8 Da) were synthesized in-house using routine techniques of Fmoc/^tBu SPPS methodology [61].	PMC8469417	RKKRRQRRRGG
4. Materials and Methods; 4.1. Synthesis and Characterization of Peptides; 4.1.1. Peptide Synthesis	1	3	Peptides RKKRRQRRRGG-Sar-GLHITD-Nle-AWKR (R23R*, 2815.3 Da), RKKRRQRRRGG-Sar-GITDFGIFIGL (R23L*, 2658.1 Da), and RKKRRQRRRGG-Sar (R12-Sar, 1523.8 Da) were synthesized in-house using routine techniques of Fmoc/^tBu SPPS methodology [61].	PMC8469417	GITDFGIFIGL
4. Materials and Methods; 4.1. Synthesis and Characterization of Peptides; 4.1.1. Peptide Synthesis	1	3	Peptides RKKRRQRRRGG-Sar-GLHITD-Nle-AWKR (R23R*, 2815.3 Da), RKKRRQRRRGG-Sar-GITDFGIFIGL (R23L*, 2658.1 Da), and RKKRRQRRRGG-Sar (R12-Sar, 1523.8 Da) were synthesized in-house using routine techniques of Fmoc/^tBu SPPS methodology [61].	PMC8469417	RKKRRQRRRGG
4. Materials and Methods; 4.1. Synthesis and Characterization of Peptides; 4.1.2. Bioinformatic Analysis of Peptides	1	2	Predicted amyloidogenic regions were checked in vitro by their ability to form amyloid-like aggregates and two sequences (LHITDMAWKR, ITDFGIFIGL) were used as “amyloidogenic” parts for the R23R, R23L, R23R*, and R23L* peptides.	PMC8469417	LHITDMAWKR
