section	paragraph	sentence	text	pmcid	matched_sequence
Introduction	2	8	We select six different AMPs:(1)Clavanin A (Cla, VFQFLGKIIHHVGNFVHGFSHVF, 23 a.a.) is from Styela clava (a sea squirt).	PMC6705042	VFQFLGKIIHHVGNFVHGFSHVF
Introduction	2	9	[25](2)Cecropin A (Cec, KWKLFKKIEKVGQNIRDGIIKAGPAVAVVGQATQIAK, 37 a.a.) is from Hyalophora cecropia (a moth).	PMC6705042	KWKLFKKIEKVGQNIRDGIIKAGPAVAVVGQATQIAK
Introduction	2	10	[26](3)Pardaxin P5 (Par, GFFALIPKIISSPLFKTLLSAVGSALSSSGDQE, 33 a.a.) is from Pardachirus marmoratus (a red sea sole).	PMC6705042	GFFALIPKIISSPLFKTLLSAVGSALSSSGDQE
Introduction	2	11	[27](4)Magainin 1 (Mag, GIGKFLHSAGKFGKAFVGEIMKS, 23 a.a.) is from Xenopus laevis (an African clawed frog).	PMC6705042	GIGKFLHSAGKFGKAFVGEIMKS
Introduction	2	12	[28](5)SL-37 (SLGNFFRKARKKIGEEFKRIVQRIKDFLQHLIPRTEA, 37 a.a.) is from Hylobates moloch (a gibbon).	PMC6705042	SLGNFFRKARKKIGEEFKRIVQRIKDFLQHLIPRTEA
Introduction	2	13	[29](6)LL-37 (LLGDFFRKSKEKIGKEFKRIVQRIKDFLRNLVPRTES, 37 a.a.) is from Homo sapiens (a human).	PMC6705042	LLGDFFRKSKEKIGKEFKRIVQRIKDFLRNLVPRTES
1. Introduction	3	3	Melimine (TLISWIKNKRKQRPRVSRRRRRRGGRRRR) is a cationic chimeric peptide of two naturally occurring peptides melittin and protamine [17].	PMC7503749	TLISWIKNKRKQRPRVSRRRRRRGGRRRR
1. Introduction	3	6	A derivative of melimine called Mel4 (KNKRKRRRRRRGGRRRR) is active against planktonic P. aeruginosa [20].	PMC7503749	KNKRKRRRRRRGGRRRR
4. Compatibility of Released Molecules from Plants and Pathogens Determine Disease Susceptibility; 4.1. PAMP Sequence Polymorphism Influences Plant Susceptibility	1	3	The binding of flg22 to FLS2 promotes the hetero-dimerization with BRASSINOSTEROID INSENSITIVE 1-associated receptor kinase 1 (BAK1), which acts as the co-receptor of the C-terminus of FLS-bound flg22, leading to the activation of innate plant immunity against pathogens [73].	PMC7730307	INSENSITIVE
2. Materials and Methods; 2.1. Materials	1	6	Antimicrobial peptide PEP-1 (RRRGRRRGPPGRRRGRRR) was synthesized via standard Fmoc-solid phase peptide synthesis protocol and purified in our lab with a purity of 98% as determined by HPLC.	PMC6566986	RRRGRRRGPPGRRRGRRR
4. Discussion	1	4	PEP-1 (RRRGRRRGPPGRRRGRRR) in this study is a cationic hydrophilic short peptide, with low toxicity to mammalian cells and broad-spectrum bactericidal activities.	PMC6566986	RRRGRRRGPPGRRRGRRR
Antimicrobial Peptides	6	2	The peptide WR12 (RWWRWWRRWWRR) is a de novo designed short synthetic peptide, composed exclusively of arginine and tryptophan amino acid residues.	PMC7892433	RWWRWWRRWWRR
Cell-Penetrating Peptides	5	3	CPPs, including α1H (KSKTEYYNAWAVWERNAPC), α2H (GNGEQREM AVSRLRDCLDRQA), and TAT peptide have been used in this regard (Gomarasca et al., 2017).	PMC7892433	KSKTEYYNAWAVWERNAPC
Cell-Penetrating Peptides	5	3	CPPs, including α1H (KSKTEYYNAWAVWERNAPC), α2H (GNGEQREM AVSRLRDCLDRQA), and TAT peptide have been used in this regard (Gomarasca et al., 2017).	PMC7892433	AVSRLRDCLDRQA
4. Materials and Methods; 4.1. Peptide Synthesis	1	1	Brevinin-1RL1 (FFPLIAGLAARFLPKIFCSITKRC, M = 2711.3 g/mol) and a fluorescent dye fluorescein isothiocyanate (FITC) labeled Brevinin-1RL1 (FITC-FFPLIAGLAARFLPKIFCSITKRC, M = 3213.9 g/mol) with an intramolecular disulfide bridge was synthesized by GL Biochem Ltd (Shanghai, China).	PMC8038347	FFPLIAGLAARFLPKIFCSITKRC
4. Materials and Methods; 4.1. Peptide Synthesis	1	1	Brevinin-1RL1 (FFPLIAGLAARFLPKIFCSITKRC, M = 2711.3 g/mol) and a fluorescent dye fluorescein isothiocyanate (FITC) labeled Brevinin-1RL1 (FITC-FFPLIAGLAARFLPKIFCSITKRC, M = 3213.9 g/mol) with an intramolecular disulfide bridge was synthesized by GL Biochem Ltd (Shanghai, China).	PMC8038347	FFPLIAGLAARFLPKIFCSITKRC
2. Materials and Methods; 2.1. Peptides; 2.1.1. Selection of a Peptide-Template	1	1	To search for a template, six AMPs that have never been tested against Salmonella were used in this study, including peptide KLK (KLKLLLLLKLK) and KLK1 (KLKLLLLLKL) derived from sapecin B of flesh fly (Sarcophaga peregrina) larva [12,13,14,15,16,17], BmKn-2 (FIGAIARLLSKIF), and BmKn-22 (FIGAIARLLSK) derived from scorpion (Buthus martensii Karsch) venom [18,19,20,21,22], and Pug-1 (LLKLFFPFLETGE) and Pug-4 (FPSFLVGR) derived from pomegranate (Punica granatum L.) fruit [23].	PMC8348142	KLKLLLLLKLK
2. Materials and Methods; 2.1. Peptides; 2.1.1. Selection of a Peptide-Template	1	1	To search for a template, six AMPs that have never been tested against Salmonella were used in this study, including peptide KLK (KLKLLLLLKLK) and KLK1 (KLKLLLLLKL) derived from sapecin B of flesh fly (Sarcophaga peregrina) larva [12,13,14,15,16,17], BmKn-2 (FIGAIARLLSKIF), and BmKn-22 (FIGAIARLLSK) derived from scorpion (Buthus martensii Karsch) venom [18,19,20,21,22], and Pug-1 (LLKLFFPFLETGE) and Pug-4 (FPSFLVGR) derived from pomegranate (Punica granatum L.) fruit [23].	PMC8348142	KLKLLLLLKL
2. Materials and Methods; 2.1. Peptides; 2.1.1. Selection of a Peptide-Template	1	1	To search for a template, six AMPs that have never been tested against Salmonella were used in this study, including peptide KLK (KLKLLLLLKLK) and KLK1 (KLKLLLLLKL) derived from sapecin B of flesh fly (Sarcophaga peregrina) larva [12,13,14,15,16,17], BmKn-2 (FIGAIARLLSKIF), and BmKn-22 (FIGAIARLLSK) derived from scorpion (Buthus martensii Karsch) venom [18,19,20,21,22], and Pug-1 (LLKLFFPFLETGE) and Pug-4 (FPSFLVGR) derived from pomegranate (Punica granatum L.) fruit [23].	PMC8348142	FIGAIARLLSKIF
2. Materials and Methods; 2.1. Peptides; 2.1.1. Selection of a Peptide-Template	1	1	To search for a template, six AMPs that have never been tested against Salmonella were used in this study, including peptide KLK (KLKLLLLLKLK) and KLK1 (KLKLLLLLKL) derived from sapecin B of flesh fly (Sarcophaga peregrina) larva [12,13,14,15,16,17], BmKn-2 (FIGAIARLLSKIF), and BmKn-22 (FIGAIARLLSK) derived from scorpion (Buthus martensii Karsch) venom [18,19,20,21,22], and Pug-1 (LLKLFFPFLETGE) and Pug-4 (FPSFLVGR) derived from pomegranate (Punica granatum L.) fruit [23].	PMC8348142	FIGAIARLLSK
2. Materials and Methods; 2.1. Peptides; 2.1.1. Selection of a Peptide-Template	1	1	To search for a template, six AMPs that have never been tested against Salmonella were used in this study, including peptide KLK (KLKLLLLLKLK) and KLK1 (KLKLLLLLKL) derived from sapecin B of flesh fly (Sarcophaga peregrina) larva [12,13,14,15,16,17], BmKn-2 (FIGAIARLLSKIF), and BmKn-22 (FIGAIARLLSK) derived from scorpion (Buthus martensii Karsch) venom [18,19,20,21,22], and Pug-1 (LLKLFFPFLETGE) and Pug-4 (FPSFLVGR) derived from pomegranate (Punica granatum L.) fruit [23].	PMC8348142	LLKLFFPFLETGE
2. Materials and Methods; 2.1. Peptides; 2.1.2. Redesign of Peptides by Template Modifications	1	5	These tailorings included replacing certain positions of amino acids with R (Kn2-5R; FIRRIARLLRRIF), modifying C-terminal COOH to CONH_2 (Kn2-5R-NH_2; FIRRIARLLRRIF-NH_2), replacing all L- with d-amino acids (dKn2-5R-NH_2; firriarllrrif-NH_2), and adding F residues at the N-terminus (2F-Kn2-5R-NH_2; FFFIRRIARLLRRIF-NH_2).	PMC8348142	FIRRIARLLRRIF
2. Materials and Methods; 2.1. Peptides; 2.1.2. Redesign of Peptides by Template Modifications	1	5	These tailorings included replacing certain positions of amino acids with R (Kn2-5R; FIRRIARLLRRIF), modifying C-terminal COOH to CONH_2 (Kn2-5R-NH_2; FIRRIARLLRRIF-NH_2), replacing all L- with d-amino acids (dKn2-5R-NH_2; firriarllrrif-NH_2), and adding F residues at the N-terminus (2F-Kn2-5R-NH_2; FFFIRRIARLLRRIF-NH_2).	PMC8348142	FIRRIARLLRRIF
2. Materials and Methods; 2.1. Peptides; 2.1.2. Redesign of Peptides by Template Modifications	1	5	These tailorings included replacing certain positions of amino acids with R (Kn2-5R; FIRRIARLLRRIF), modifying C-terminal COOH to CONH_2 (Kn2-5R-NH_2; FIRRIARLLRRIF-NH_2), replacing all L- with d-amino acids (dKn2-5R-NH_2; firriarllrrif-NH_2), and adding F residues at the N-terminus (2F-Kn2-5R-NH_2; FFFIRRIARLLRRIF-NH_2).	PMC8348142	FFFIRRIARLLRRIF
3. Results and Discussion; 3.4. All Kn2 Variants Exerted Antibiofilm Properties	2	2	It might be possible that the fundamental factor of the activity is the result of the “FIRRIARLLRRIF” amino acid sequence common in all variants.	PMC8348142	FIRRIARLLRRIF
3. Results and Discussion; 3.4. All Kn2 Variants Exerted Antibiofilm Properties	2	6	Apart from the antibacterial and antibiofilm properties reported in this study, the motif sequence of FIRRIARLLRRIF has been reported recently in cell-penetrating peptides (CPPs) [50].	PMC8348142	FIRRIARLLRRIF
Abstract	1	1	The pore forming properties of synthetic cecropin-melittin hybrid peptide (Acetyl-KWKLFKKIGAVLKVL-CONH2; CM15) were investigated by using photoreceptor rod outer segments (OS) isolated from frog retinae obtained by using the whole-cell configuration of the patch-clamp technique.	PMC6255091	KWKLFKKIGAVLKVL
3. Experimental Section	4	1	The primary structure of CM15 peptide was: acetyl-KWKLFKKIGAVLKVL-CONH_2; as a control, to ensure that the CM15-induced permeabilisation was not due to some aspecific effect produced by the interaction of one or more of its aminoacids with some membrane protein, a “scrambled” version of CM15 was tested (primary structure: acetyl-KWKLKFKIGLVKLVAV-NH_2).	PMC6255091	KWKLFKKIGAVLKVL
3. Experimental Section	4	1	The primary structure of CM15 peptide was: acetyl-KWKLFKKIGAVLKVL-CONH_2; as a control, to ensure that the CM15-induced permeabilisation was not due to some aspecific effect produced by the interaction of one or more of its aminoacids with some membrane protein, a “scrambled” version of CM15 was tested (primary structure: acetyl-KWKLKFKIGLVKLVAV-NH_2).	PMC6255091	KWKLKFKIGLVKLVAV
[Introduction]	5	1	Aurein 1.2 is a 13-amino acid peptide (GLFDIIKKIAESF-NH_2) secreted by the Australian green and golden bell frog Litoria aurea and by the related Australian southern bell frog Litoria reinforms36 and is the smallest AMP secreted by vertebrates.	PMC4648102	GLFDIIKKIAESF
Materials and Methods; Peptides Synthesis	1	1	Four peptides AS-hepc3_(41-71) (SPAGRNSRRRRCRFCCGCCPDMVGCGTCCKF), AS-hepc3_(52-71) (CRFCCGCCPDMVGCGTCCKF), AS-hepc3_(41-51) (SPAGRNSRRRR), and AS-hepc3_(48-56) (RRRRCRFCC) derived from AS-hepc3 (GenBank: AAU00796.2) were chemically synthesized by GL Biochem (Shanghai, China) with a purity of >95%, and verified by HPLC and mass spectrometry.	PMC8523948	SPAGRNSRRRRCRFCCGCCPDMVGCGTCCKF
Materials and Methods; Peptides Synthesis	1	1	Four peptides AS-hepc3_(41-71) (SPAGRNSRRRRCRFCCGCCPDMVGCGTCCKF), AS-hepc3_(52-71) (CRFCCGCCPDMVGCGTCCKF), AS-hepc3_(41-51) (SPAGRNSRRRR), and AS-hepc3_(48-56) (RRRRCRFCC) derived from AS-hepc3 (GenBank: AAU00796.2) were chemically synthesized by GL Biochem (Shanghai, China) with a purity of >95%, and verified by HPLC and mass spectrometry.	PMC8523948	CRFCCGCCPDMVGCGTCCKF
Materials and Methods; Peptides Synthesis	1	1	Four peptides AS-hepc3_(41-71) (SPAGRNSRRRRCRFCCGCCPDMVGCGTCCKF), AS-hepc3_(52-71) (CRFCCGCCPDMVGCGTCCKF), AS-hepc3_(41-51) (SPAGRNSRRRR), and AS-hepc3_(48-56) (RRRRCRFCC) derived from AS-hepc3 (GenBank: AAU00796.2) were chemically synthesized by GL Biochem (Shanghai, China) with a purity of >95%, and verified by HPLC and mass spectrometry.	PMC8523948	SPAGRNSRRRR
Materials and Methods; Polyclonal Antibody Preparation	1	2	The synthesis of the selected antigenic site (SPAGRNSRRRRC), the preparation of peptide-KLH conjugated immunogen, the construction of immune host strain (New Zealand Rabbit), and the affinity purification of antibody were performed by GenScript (Nanjing, China).	PMC8523948	SPAGRNSRRRRC
1. Introduction	2	2	Multiple AMPs have been found in this venom, including the 24-residue peptide Smp24 (IWSFLIKAATKLLPSLFGGGKKDS).	PMC10610086	IWSFLIKAATKLLPSLFGGGKKDS
Abstract	1	3	In this work, we explored the activity against Staphylococcus epidermidis (S. epidermidis) of the α-helical antimicrobial peptide (AMP) MSI-78(4-20) (KFLKKAKKFGKAFVKIL) when covalently bound to a chitosan coating.	PMC7412451	KFLKKAKKFGKAFVKIL
1. Introduction	3	1	In this work, we explored the activity of the α-helical AMP MSI-78(4-20) (KFLKKAKKFGKAFVKIL) when covalently bound to a chitosan coating against Staphylococcus epidermidis (S. epidermidis).	PMC7412451	KFLKKAKKFGKAFVKIL
1. Introduction	3	2	The AMP MSI-78(4-20) (17 mer) is an improved version of its parent MSI-78 (GIGKFLKKAKKFGKAFVKILKK) (22 mer), i.e., it is a cost-effective short AMP that has been demonstrated to be equally potent and less toxic to eukaryotic cells than its parent peptide [6].	PMC7412451	GIGKFLKKAKKFGKAFVKILKK
4. Materials and Methods; 4.1. Peptides Synthesis and Characterization	1	1	Peptides MSI-78(4-20) (KFLKKAKKFGKAFVKIL), Cys-Ahx-MSI-78(4-20) (SH-AMP), and MSI-78(4-20)-Ahx-Cys (AMP-SH) were produced via Fmoc/tBu solid-phase peptide synthesis methodologies assisted with microwave energy (Liberty 1 Microwave Peptide Synthesizer, CEM Corporation, Matthews, NC, USA).	PMC7412451	KFLKKAKKFGKAFVKIL
4. Materials and Methods; 4.4. Antimicrobial Activity; 4.4.2. Adhesion and Viability Test	1	11	Finally, surfaces were mounted on slides using VECTASHIELD^® mounting medium for microscopy observation.	PMC7412451	VECTASHIELD
2. Materials and Methods; 2.3. Model Structures and Training; 2.3.1. Generative Model	1	9	For example, for the sequence VDKGSYRPRPTPPKPIYNRN, VDKGSYRPRPTPPKPIYNR was the training data, and DKGSYRPRPTPPKPIYNRN the target.	PMC8004669	VDKGSYRPRPTPPKPIYNRN
2. Materials and Methods; 2.3. Model Structures and Training; 2.3.1. Generative Model	1	9	For example, for the sequence VDKGSYRPRPTPPKPIYNRN, VDKGSYRPRPTPPKPIYNR was the training data, and DKGSYRPRPTPPKPIYNRN the target.	PMC8004669	VDKGSYRPRPTPPKPIYNR
2. Materials and Methods; 2.3. Model Structures and Training; 2.3.1. Generative Model	1	9	For example, for the sequence VDKGSYRPRPTPPKPIYNRN, VDKGSYRPRPTPPKPIYNR was the training data, and DKGSYRPRPTPPKPIYNRN the target.	PMC8004669	DKGSYRPRPTPPKPIYNRN
Methods; Mycobacterium abscessus strains, growth conditions and arenicin peptides	1	2	We used Ar-1 (RWC^3VYAYVRVRGVLVRYRRC^20W) and Ar-1-Abu, in which the cysteines in position 3 and 20 were replaced by alpha-amino-n-butyric acid (Abu) residues.	PMC10823733	VYAYVRVRGVLVRYRRC
Methods; Mycobacterium abscessus strains, growth conditions and arenicin peptides	1	3	We also tested Ar-2 (RWC^3VYAYVRIRGVLVRYRRC^20W), Ar-2-Abu (cysteines 3 and 20 replaced), Ar-3 (GFC^3WYVC^7VYRNGVRVC^16YRRC^20N), Ar-3-Abu (all four cysteines were replaced by Abu), Ar-3(3-20) (cysteines 7 and 16 replaced), and Ar-3(7-16) (cysteines 3 and 20 replaced).	PMC10823733	VYAYVRIRGVLVRYRRC
Abstract	178	1	P090 - The SAATELLITE Study: Prevention of S aureus Nosocomial Pneumonia (NP) with MEDI4893, a Human Monoclonal Antibody (mAb) Against S aureus	PMC5493079	SAATELLITE
P043 Recognition and treatment of sepsis on labour ward– teaching & information resources can improve knowledge; J. Heaton, A. Boyce, L. Nolan, J. Johnston, A. Dukoff-Gordon, A. Dean, A. Molokhia; Lewisham and Greenwich NHS Trust, London, UK	6	1	SEPSIS 6 MANAGEMENT: Staff knew 4.8/6 of the Sepsis Six steps for management and 88 % knew it was required within an hour.	PMC5493079	MANAGEMENT
P090 The SAATELLITE Study: Prevention of S aureus Nosocomial Pneumonia (NP) with MEDI4893, a Human Monoclonal Antibody (mAb) Against S aureus; B. François^1, P. F. Laterre^2, P. Eggimann^3, A. Torres^4, M. Sánchez^5, P. F. Dequin^6, G. L. Bassi^4, J. Chastre^7, H. S. Jafri^8; ^1CHU Dupuytren, Limoges, France; ^2St Luc University Hospital, Brussels, Belgium; ^3CHUV, Lausanne, Switzerland; ^4Hospital Clinic of Barcelona, Barcelona, Spain; ^5Hospital Clínico San Carlos, Madrid, Spain; ^6Université François Rabelais and CHU Bretonneau, Tours, France; ^7Groupe Hospitalier Pitié-Salpêtrière, Paris, France; ^8MedImmune, Gaithersburg, USA	1	4	We describe the rationale and design of the SATTELLITE study to investigate the use of MEDI4893 in mechanically-ventilated (MV) subjects.	PMC5493079	SATTELLITE
P090 The SAATELLITE Study: Prevention of S aureus Nosocomial Pneumonia (NP) with MEDI4893, a Human Monoclonal Antibody (mAb) Against S aureus; B. François^1, P. F. Laterre^2, P. Eggimann^3, A. Torres^4, M. Sánchez^5, P. F. Dequin^6, G. L. Bassi^4, J. Chastre^7, H. S. Jafri^8; ^1CHU Dupuytren, Limoges, France; ^2St Luc University Hospital, Brussels, Belgium; ^3CHUV, Lausanne, Switzerland; ^4Hospital Clinic of Barcelona, Barcelona, Spain; ^5Hospital Clínico San Carlos, Madrid, Spain; ^6Université François Rabelais and CHU Bretonneau, Tours, France; ^7Groupe Hospitalier Pitié-Salpêtrière, Paris, France; ^8MedImmune, Gaithersburg, USA	3	1	Methods: SAATELLITE is a randomized, double-blind, placebo-controlled, dose-ranging Phase 2 study to investigate the efficacy and safety of MEDI4893 in MV subjects.	PMC5493079	SAATELLITE
P090 The SAATELLITE Study: Prevention of S aureus Nosocomial Pneumonia (NP) with MEDI4893, a Human Monoclonal Antibody (mAb) Against S aureus; B. François^1, P. F. Laterre^2, P. Eggimann^3, A. Torres^4, M. Sánchez^5, P. F. Dequin^6, G. L. Bassi^4, J. Chastre^7, H. S. Jafri^8; ^1CHU Dupuytren, Limoges, France; ^2St Luc University Hospital, Brussels, Belgium; ^3CHUV, Lausanne, Switzerland; ^4Hospital Clinic of Barcelona, Barcelona, Spain; ^5Hospital Clínico San Carlos, Madrid, Spain; ^6Université François Rabelais and CHU Bretonneau, Tours, France; ^7Groupe Hospitalier Pitié-Salpêtrière, Paris, France; ^8MedImmune, Gaithersburg, USA	5	1	Conclusions: The SAATELLITE study represents an innovative pre-emptive therapy approach to prevent S aureus nosocomial pneumonia in MV patients, by utilizing the novel monoclonal antibody MEDI4893, thereby offering a new paradigm in S aureus infection management in high-risk patients.	PMC5493079	SAATELLITE
P102 Nosocomial pneumonia - emphasis on inhaled tobramycin; A. Kuzovlev^1, A. Shabanov^2, S. Polovnikov^3, V. Moroz^1; ^1V.A. Negovsky Research Institute of General Reanimatology, Moscow, Russia; ^2N.V. Sklifosofsky Institute of Emergency Medicine, Moscow, Russia;^3NN Burdenko Main Military Hospital, Moscow, Russia	2	8	The data were statistically analyzed by STATISTICA 7.0 (M, σ, Newman- Keuls test; p < 0.05).	PMC5493079	STATISTICA
P267 New molecular biomarkers of acute respiratory distress syndrome in abdominal sepsis; A. K. Kuzovlev^1, V. Moroz^1, A. Goloubev^1, S. Polovnikov^2, S. Nenchuk^2; ^1V.A. Negovsky Research Institute of General Reanimatology, Moscow, Russia; ^2NN Burdenko Main Military Hospital, Moscow, Russia	2	6	Data were statistically analyzed by STATISTICA 7.0, ANOVA and presented as median and 25-75th percentiles (ng/ml); p < 0.05 was considered statistically significant.	PMC5493079	STATISTICA
2. Materials and Methods	3	1	Toxins: Candidalysin (SIIGIIMGILGNIPQVIQIIMSIVKAFKGNK) was synthesised by Peptide Protein Research Ltd (UK), solubilised in culture grade water and stored at 10 mg/mL at −20 °C.	PMC7140650	SIIGIIMGILGNIPQVIQIIMSIVKAFKGNK
2. Materials and Methods; 2.1. Peptides	1	1	TAMRA-TAT (TAMRA-YGRKKRRQRRR) peptide was purchased from Eurogentec, Belgium.	PMC9415903	YGRKKRRQRRR
2. Materials and Methods; 2.1. Peptides	3	1	Dy647P1-NKCS (Dy647P1-KILRGVSKKIMRTFLRRISKDILTGKK) peptide has Mw of 4005 g/mol, a net charge of +10 at pH 7.0 and the isoelectric point 12.98.	PMC9415903	KILRGVSKKIMRTFLRRISKDILTGKK
2. Materials and Methods; 2.1. Peptides	4	1	The Dy647P1-NKCS-[15-27] (Dy647P1-LRRISKDILTGKK) peptide is the second helix of NKCS, with Mw 2346 g/mol, net charge +5 at pH 7.0 and an isoelectric point of 12.54.	PMC9415903	LRRISKDILTGKK
Abstract	2	3	Lubelisin (GIVAWFWRLAR) is an α-helical peptide, 11 amino acid long with theoretical molecular weight of 1373.76 D.	PMC8034185	GIVAWFWRLAR
Results; In silico mining of antimicrobial peptides and screening against bacterial strains	1	5	Thirteen of these 208 peptides showed promising activity in the spot screen, one of which - Lubelisin (GIVAWFWRLAR) was selected for further testing.	PMC8034185	GIVAWFWRLAR
Results; AMP structure predictions and biophysical parameters	1	1	Lubelisin (GIVAWFWRLAR, molecular weight 1373.76) is 11 amino acids (AAs) in length, is positively charged (+ 2) and highly hydrophobic with 72% hydrophobic residues, features, which are common characteristics of antimicrobial peptides (Fig 1).	PMC8034185	GIVAWFWRLAR
1. Introduction	3	5	Pln149 contains the sequence YSLQMGATAIKQVKKLFKKKGG and shows inhibitory activity against other lactobacilli.	PMC9952790	YSLQMGATAIKQVKKLFKKKGG
1. Introduction	6	1	In this study, we present Pln149-PEP20 (Fmoc-KAVKKLFKKWG), an optimized molecule based on Fmoc-Pln149(6-22), which was designed as an amphipathic alpha helix to enhance antimicrobial activity and lower cytotoxicity.	PMC9952790	KAVKKLFKKWG
1. Introduction	2	3	One of the best studied vipericidins, crotalicidin (Ctn), a linear 34-residue peptide (KRFKKFFKKVKKSVKKRLKKIFKKPMVIGVTIPF), rich in basic (Lys, Arg) residues and with an α-helical fold, is generated from a precursor made up of a signal peptide and a cathelin domain [1,4].	PMC7664368	KRFKKFFKKVKKSVKKRLKKIFKKPMVIGVTIPF
1. Introduction	2	4	Its short N- and C-terminal fragments, Ctn[1-14] (KRFKKFFKKVKKSV) and Ctn[15-34] (KKRLKKIFKKPMVIGVTIPF), respectively, result from a careful structural dissection of the full-length Ctn and have been studied for anti-infective (antimicrobial, anti-parasite, and antiviral) and anti-proliferative properties (antitumoral), as reported elsewhere [13,14].	PMC7664368	KRFKKFFKKVKKSV
1. Introduction	2	4	Its short N- and C-terminal fragments, Ctn[1-14] (KRFKKFFKKVKKSV) and Ctn[15-34] (KKRLKKIFKKPMVIGVTIPF), respectively, result from a careful structural dissection of the full-length Ctn and have been studied for anti-infective (antimicrobial, anti-parasite, and antiviral) and anti-proliferative properties (antitumoral), as reported elsewhere [13,14].	PMC7664368	KKRLKKIFKKPMVIGVTIPF
4. Material and Methods; 4.1. Peptides	1	1	Ctn (KRFKKFFKKVKKSVKKRLKKIFKKPMVIGVTIPF), Ctn[1-14] (KRFKKFFKKVKKSV), and Ctn[15-34] (KKRLKKIFKKPMVIGVTIPF) were synthesized by solid phase methods, purified by HPLC to >95% homogeneity, and characterized by ESI-mass spectrometry, as previously described [13].	PMC7664368	KRFKKFFKKVKKSVKKRLKKIFKKPMVIGVTIPF
4. Material and Methods; 4.1. Peptides	1	1	Ctn (KRFKKFFKKVKKSVKKRLKKIFKKPMVIGVTIPF), Ctn[1-14] (KRFKKFFKKVKKSV), and Ctn[15-34] (KKRLKKIFKKPMVIGVTIPF) were synthesized by solid phase methods, purified by HPLC to >95% homogeneity, and characterized by ESI-mass spectrometry, as previously described [13].	PMC7664368	KRFKKFFKKVKKSV
4. Material and Methods; 4.1. Peptides	1	1	Ctn (KRFKKFFKKVKKSVKKRLKKIFKKPMVIGVTIPF), Ctn[1-14] (KRFKKFFKKVKKSV), and Ctn[15-34] (KKRLKKIFKKPMVIGVTIPF) were synthesized by solid phase methods, purified by HPLC to >95% homogeneity, and characterized by ESI-mass spectrometry, as previously described [13].	PMC7664368	KKRLKKIFKKPMVIGVTIPF
2. Materials and Methods; 2.2. Construct Cloning	3	2	Three fusions with optimized fragments of the cell membrane permeabilizing antimicrobial peptide SMAP-29 (1-17, K2,7,13, RKLRRLKRKIAHKVKKY) were obtained.	PMC7175214	RKLRRLKRKIAHKVKKY
2. Materials and Methods; 2.2. Construct Cloning	3	3	They differed in the peptide linker between the LysECD7 endolysin ORF and SMAP-peptide: the pBad24-LysECD7-SMAP-Mxe vector contained no linkers, pBad24-LysECD7-flex-SMAP-Mxe contained a flexible linker (GSAGSAAGSGEF), and pBad24-LysECD7-rigid-SMAP-Mxe contained a rigid linker (AEAAAKEAAAKEAAAKA).	PMC7175214	GSAGSAAGSGEF
2. Materials and Methods; 2.2. Construct Cloning	3	3	They differed in the peptide linker between the LysECD7 endolysin ORF and SMAP-peptide: the pBad24-LysECD7-SMAP-Mxe vector contained no linkers, pBad24-LysECD7-flex-SMAP-Mxe contained a flexible linker (GSAGSAAGSGEF), and pBad24-LysECD7-rigid-SMAP-Mxe contained a rigid linker (AEAAAKEAAAKEAAAKA).	PMC7175214	AEAAAKEAAAKEAAAKA
3. Results; 3.3. Improvement of Endolysin LysECD7 Bactericidal Activity through a Fragment of SMAP-29 Peptide Fusion	2	3	An optimized fragment of the SMAP-29 (1-17, K2,7,13, RKLRRLKRKIAHKVKKY) sequence with improved antimicrobial activity and without hemolytic toxicity was used [28,29].	PMC7175214	RKLRRLKRKIAHKVKKY
4. Discussion	4	3	It was suggested that membrane penetration occurs non-specifically through positively charged His-tag clusters (KLEHHHHHHHH).	PMC7175214	KLEHHHHHHHH
4. Discussion	11	1	Here, we evaluated the effects of three different chimeras, including the fusion between LysECD7 and optimized SMAP-29 through a Gly- and Ser-rich flexible linker (flexible, GSAGSAAGSGEF) [44], which avoided large hydrophobic residues to maintain good solubility in aqueous solutions, and a monomeric α-helix linker (rigid, AEAAAKEAAAKEAAAKA) [45], which is frequently used when it is crucial to keep a fixed distance between the functional domains for their spatial separation to maintain the stability or bioactivity of the fusion proteins [46].	PMC7175214	GSAGSAAGSGEF
4. Discussion	11	1	Here, we evaluated the effects of three different chimeras, including the fusion between LysECD7 and optimized SMAP-29 through a Gly- and Ser-rich flexible linker (flexible, GSAGSAAGSGEF) [44], which avoided large hydrophobic residues to maintain good solubility in aqueous solutions, and a monomeric α-helix linker (rigid, AEAAAKEAAAKEAAAKA) [45], which is frequently used when it is crucial to keep a fixed distance between the functional domains for their spatial separation to maintain the stability or bioactivity of the fusion proteins [46].	PMC7175214	AEAAAKEAAAKEAAAKA
2. Results and Discussion; 2.5. Antibacterial Activity of the Polymer Discs Against S. mutans 	1	4	In the current study, we investigated the activity of the antimicrobial peptides in the presence of the spacer sequence (KGGGKWKRWWWWR-NH2).	PMC8235192	KGGGKWKRWWWWR
